<?xml version="1.0" encoding="UTF-8"  ?>
<!DOCTYPE maf-command PUBLIC
         "-//Miranet//DTD maf-command config XML V1.0//EN"
         "excel-viewer.dtd">
<viewer filename="진도현황.xls" title="진도현황">
	<field id="rownum" title="No"   />
	<field id="prtcode" title="과정코드"   />
	<field id="leccode" title="강의코드"   />
	<field id="lecname" title="강의명"   />
	<field id="lec_sdate" title="강의시작일" />
	<field id="lec_edate" title="강의종료일"  />
	<field id="usrid" title="학습자ID"/>
	<field id="usernm" title="학습자명"  />
	<field id="pin" title="주민등록번호"/>
	<field id="company_nm" title="회사명"/>
	<field id="attach_company" title="소속업체"/>
	<field id="is_insurance" title="환급여부"/>
	<field id="is_grad" title="수료여부"/>
	<field id="sum_score" title="총점"/>
	<field id="test_score" title="시험"/>
	<field id="rpt_score" title="과제"/>
	<field id="jindo_score" title="진도"/>
	<field id="tot_time" title="학습시간"/>
	<field id="email" title="Email"/>
	<field id="hp" title="핸드폰번호"/>
</viewer>
