<?xml version="1.0" encoding="UTF-8"  ?>
<!DOCTYPE maf-command PUBLIC
         "-//Miranet//DTD maf-command config XML V1.0//EN"
         "excel-viewer.dtd">
<viewer filename="Lecture.xls" title="">
	<field id="userid" title="User ID" align="center"/>
	<field id="leccode" title="Lecture Code" align="center"/>
	<field id="lecnumb" title="Lecnumb" align="center"/>
	<field id="req_stat" title="Status"/>
	<field id="req_dt" title="Request Date"/>
	<field id="lecname" title="Lectue Name" align="center"/>
	<field id="alias_cd" title="Local Code" align="center"/>
	<field id="nm" title="User Name" align="center"/>
</viewer>